{
  "contract_version": "1.0",
  "message_type": "orders-in",
  "message_id": "ERP-IN-001",
  "sender": "GROUP-ERP",
  "issued_at": "2026-05-04T08:00:00",
  "external_order_ref": "GRP-SO-77001",
  "external_order_kind": "sales-order",
  "demand": {
    "item_code": "RW-CHM-0003",
    "quantity": 500.0,
    "uom": "Kg",
    "warehouse": "FG Lager Süd - RWC",
    "required_by": "2026-06-01",
    "customer_ref": "KD-4711"
  }
}
